<?xml version="1.0" encoding="UTF-8"?>
<empDetails xmlns:xsi="http://www.w3.org/2001/XMLSchema-instance"
xsi:noNamespaceSchemaLocation="lab5.2.xsd">
  <employee>
    <Ecode>1111</Ecode>
    <Ename>
      <Fname>Seema</Fname>
      <Lname>Dalvi</Lname>
    </Ename>
    <Doj>09/08/97</Doj>
    <TotalExp>12</TotalExp>
    <Department>
      <Unit>3d</Unit>
      <loc>Mumbai</loc>
    </Department>
    <Designation>
      <one></one>
      <two></two>
      <three></three>
      <four>*</four>
    </Designation>
    <Sal>21000</Sal>
    <Grade>
      <a></a>
      <b>*</b>
      <c></c>
      <d></d>
    </Grade>
  </employee>
  <employee>
    <Ecode>222</Ecode>
    <Ename>
      <Fname>Bharti</Fname>
      <Lname>Mantri</Lname>
    </Ename>
    <Doj>12/02/99</Doj>
    <TotalExp>5</TotalExp>
    <Department>
      <Unit>4a</Unit>
      <loc>Pune</loc>
    </Department>
    <Designation>
      <one></one>
      <two>*</two>
      <three></three>
      <four></four>
    </Designation>
    <Sal>12000</Sal>
    <Grade>
      <a>*</a>
      <b></b>
      <c></c>
      <d></d>
    </Grade>
  </employee>
</empDetails>

